{
  "0": {
    "value": 0,
    "type": "zIndex",
    "description": "Base stacking level."
  },
  "10": {
    "value": 10,
    "type": "zIndex",
    "description": "Low elevation stacking."
  },
  "20": {
    "value": 20,
    "type": "zIndex",
    "description": "Slight elevation stacking."
  },
  "30": {
    "value": 30,
    "type": "zIndex",
    "description": "Medium-low elevation stacking."
  },
  "40": {
    "value": 40,
    "type": "zIndex",
    "description": "Medium elevation stacking."
  },
  "50": {
    "value": 50,
    "type": "zIndex",
    "description": "Medium-high elevation stacking."
  },
  "60": {
    "value": 60,
    "type": "zIndex",
    "description": "High elevation stacking."
  },
  "70": {
    "value": 70,
    "type": "zIndex",
    "description": "Higher elevation stacking."
  },
  "80": {
    "value": 80,
    "type": "zIndex",
    "description": "Very high elevation stacking."
  },
  "90": {
    "value": 90,
    "type": "zIndex",
    "description": "Near-top elevation stacking."
  },
  "100": {
    "value": 100,
    "type": "zIndex",
    "description": "Top-level elevation stacking."
  },
  "auto": {
    "value": "auto",
    "type": "zIndex",
    "description": "Auto z-index, lets browser determine stacking."
  },
  "dropdown": {
    "value": 1000,
    "type": "zIndex",
    "description": "Semantic z-index for dropdown menus."
  },
  "sticky": {
    "value": 1020,
    "type": "zIndex",
    "description": "Semantic z-index for sticky positioned elements."
  },
  "fixed": {
    "value": 1030,
    "type": "zIndex",
    "description": "Semantic z-index for fixed positioned elements."
  },
  "modal-backdrop": {
    "value": 1040,
    "type": "zIndex",
    "description": "Semantic z-index for modal backdrops/overlays."
  },
  "modal": {
    "value": 1050,
    "type": "zIndex",
    "description": "Semantic z-index for modal dialogs."
  },
  "popover": {
    "value": 1060,
    "type": "zIndex",
    "description": "Semantic z-index for popovers."
  },
  "tooltip": {
    "value": 1070,
    "type": "zIndex",
    "description": "Semantic z-index for tooltips (highest)."
  }
}
